[
  {
    "Year": 2000,
    "Award": "Booker Prize",
    "Status": "Winner",
    "Title": "The Blind Assassin",
    "Author": "Margaret Atwood",
    "Publisher": "Bloomsbury"
  },
  {
    "Year": 2000,
    "Award": "Booker Prize",
    "Status": "Shortlist",
    "Title": "The Hiding Place",
    "Author": "Trezza Azzopardi",
    "Publisher": "Picador"
  },
  {
    "Year": 2000,
    "Award": "Booker Prize",
    "Status": "Shortlist",
    "Title": "The Keepers of Truth",
    "Author": "Michael Collins",
    "Publisher": "Phoenix House"
  },
  {
    "Year": 2000,
    "Award": "Booker Prize",
    "Status": "Shortlist",
    "Title": "When We Were Orphans",
    "Author": "Kazuo Ishiguro",
    "Publisher": "Faber & Faber"
  },
  {
    "Year": 2000,
    "Award": "Booker Prize",
    "Status": "Shortlist",
    "Title": "English Passengers",
    "Author": "Matthew Kneale",
    "Publisher": "Hamish Hamilton"
  },
  {
    "Year": 2000,
    "Award": "Booker Prize",
    "Status": "Shortlist",
    "Title": "The Deposition of Father McGreevy",
    "Author": "Brian O'Doherty",
    "Publisher": "Arcadia"
  },
  {
    "Year": 2001,
    "Award": "Booker Prize",
    "Status": "Winner",
    "Title": "True History of the Kelly Gang",
    "Author": "Peter Carey",
    "Publisher": "Faber & Faber"
  },
  {
    "Year": 2001,
    "Award": "Booker Prize",
    "Status": "Shortlist",
    "Title": "Atonement",
    "Author": "Ian McEwan",
    "Publisher": "Jonathan Cape"
  },
  {
    "Year": 2001,
    "Award": "Booker Prize",
    "Status": "Shortlist",
    "Title": "Oxygen",
    "Author": "Andrew Miller",
    "Publisher": "Sceptre"
  },
  {
    "Year": 2001,
    "Award": "Booker Prize",
    "Status": "Shortlist",
    "Title": "number9dream",
    "Author": "David Mitchell",
    "Publisher": "Sceptre"
  },
  {
    "Year": 2001,
    "Award": "Booker Prize",
    "Status": "Shortlist",
    "Title": "The Dark Room",
    "Author": "Rachel Seiffert",
    "Publisher": "William Heinemann"
  },
  {
    "Year": 2001,
    "Award": "Booker Prize",
    "Status": "Shortlist",
    "Title": "Hotel World",
    "Author": "Ali Smith",
    "Publisher": "Hamish Hamilton"
  },
  {
    "Year": 2001,
    "Award": "Booker Prize",
    "Status": "Longlist",
    "Title": "According to Queeney",
    "Author": "Beryl Bainbridge",
    "Publisher": "Duckworth"
  },
  {
    "Year": 2001,
    "Award": "Booker Prize",
    "Status": "Longlist",
    "Title": "If The Invader Comes",
    "Author": "Derek Beaven",
    "Publisher": "4th Estate"
  },
  {
    "Year": 2001,
    "Award": "Booker Prize",
    "Status": "Longlist",
    "Title": "A Son of War",
    "Author": "Melvyn Bragg",
    "Publisher": "Sceptre"
  },
  {
    "Year": 2001,
    "Award": "Booker Prize",
    "Status": "Longlist",
    "Title": "Shamrock Tea",
    "Author": "Ciaran Carson",
    "Publisher": "Granta Books"
  },
  {
    "Year": 2001,
    "Award": "Booker Prize",
    "Status": "Longlist",
    "Title": "The Element of Water",
    "Author": "Stevie Davies",
    "Publisher": "The Women's Press"
  },
  {
    "Year": 2001,
    "Award": "Booker Prize",
    "Status": "Longlist",
    "Title": "The Pickup",
    "Author": "Nadine Gordimer",
    "Publisher": "Bloomsbury"
  },
  {
    "Year": 2001,
    "Award": "Booker Prize",
    "Status": "Longlist",
    "Title": "Dogside Story",
    "Author": "Patricia Grace",
    "Publisher": "The Women's Press"
  },
  {
    "Year": 2001,
    "Award": "Booker Prize",
    "Status": "Longlist",
    "Title": "By The Sea",
    "Author": "Abdulrazak Gurnah",
    "Publisher": "Bloomsbury"
  },
  {
    "Year": 2001,
    "Award": "Booker Prize",
    "Status": "Longlist",
    "Title": "How to Be Good",
    "Author": "Nick Hornby",
    "Publisher": "Viking"
  },
  {
    "Year": 2001,
    "Award": "Booker Prize",
    "Status": "Longlist",
    "Title": "Wolfy and the Strudelbakers",
    "Author": "Zvi Jagendorf",
    "Publisher": "Dewi Lewis"
  },
  {
    "Year": 2001,
    "Award": "Booker Prize",
    "Status": "Longlist",
    "Title": "Translated Accounts",
    "Author": "James Kelman",
    "Publisher": "Secker & Warburg"
  },
  {
    "Year": 2001,
    "Award": "Booker Prize",
    "Status": "Longlist",
    "Title": "The Blue Tango",
    "Author": "Eoin McNamee",
    "Publisher": "Faber & Faber"
  },
  {
    "Year": 2001,
    "Award": "Booker Prize",
    "Status": "Longlist",
    "Title": "Fairness",
    "Author": "Ferdinand Mount",
    "Publisher": "Chatto & Windus"
  },
  {
    "Year": 2001,
    "Award": "Booker Prize",
    "Status": "Longlist",
    "Title": "Half a Life",
    "Author": "VS Naipaul",
    "Publisher": "Picador"
  },
  {
    "Year": 2001,
    "Award": "Booker Prize",
    "Status": "Longlist",
    "Title": "The Amber Spyglass",
    "Author": "Philip Pullman",
    "Publisher": "Scholastic"
  },
  {
    "Year": 2001,
    "Award": "Booker Prize",
    "Status": "Longlist",
    "Title": "The Death of Vishnu",
    "Author": "Manil Suri",
    "Publisher": "Bloomsbury"
  },
  {
    "Year": 2001,
    "Award": "Booker Prize",
    "Status": "Longlist",
    "Title": "The Stone Carvers",
    "Author": "Jane Urquhart",
    "Publisher": "Bloomsbury"
  },
  {
    "Year": 2001,
    "Award": "Booker Prize",
    "Status": "Longlist",
    "Title": "The Leto Bundle",
    "Author": "Marina Warner",
    "Publisher": "Chatto & Windus"
  },
  {
    "Year": 2002,
    "Award": "Booker Prize",
    "Status": "Winner",
    "Title": "Life of Pi",
    "Author": "Yann Martel",
    "Publisher": "Canongate"
  },
  {
    "Year": 2002,
    "Award": "Booker Prize",
    "Status": "Shortlist",
    "Title": "Family Matters",
    "Author": "Rohinton Mistry",
    "Publisher": "Faber & Faber"
  },
  {
    "Year": 2002,
    "Award": "Booker Prize",
    "Status": "Shortlist",
    "Title": "Unless",
    "Author": "Carol Shields",
    "Publisher": "4th Estate"
  },
  {
    "Year": 2002,
    "Award": "Booker Prize",
    "Status": "Shortlist",
    "Title": "The Story of Lucy Gault",
    "Author": "William Trevor",
    "Publisher": "Viking"
  },
  {
    "Year": 2002,
    "Award": "Booker Prize",
    "Status": "Shortlist",
    "Title": "Fingersmith",
    "Author": "Sarah Waters",
    "Publisher": "Virago"
  },
  {
    "Year": 2002,
    "Award": "Booker Prize",
    "Status": "Shortlist",
    "Title": "Dirt Music",
    "Author": "Tim Winton",
    "Publisher": "Picador"
  },
  {
    "Year": 2002,
    "Award": "Booker Prize",
    "Status": "Longlist",
    "Title": "The Strange Case of Dr Simmonds and Dr Glass",
    "Author": "Dannie Abse",
    "Publisher": "Robson Books"
  },
  {
    "Year": 2002,
    "Award": "Booker Prize",
    "Status": "Longlist",
    "Title": "Shroud",
    "Author": "John Banville",
    "Publisher": "Picador"
  },
  {
    "Year": 2002,
    "Award": "Booker Prize",
    "Status": "Longlist",
    "Title": "Critical Injuries",
    "Author": "Joan Barfoot",
    "Publisher": "The Women's Press"
  },
  {
    "Year": 2002,
    "Award": "Booker Prize",
    "Status": "Longlist",
    "Title": "Any Human Heart",
    "Author": "William Boyd",
    "Publisher": "Hamish Hamilton"
  },
  {
    "Year": 2002,
    "Award": "Booker Prize",
    "Status": "Longlist",
    "Title": "The Next Big Thing",
    "Author": "Anita Brookner",
    "Publisher": "Viking"
  },
  {
    "Year": 2002,
    "Award": "Booker Prize",
    "Status": "Longlist",
    "Title": "Peacetime",
    "Author": "Robert Edric",
    "Publisher": "Black Swan"
  },
  {
    "Year": 2002,
    "Award": "Booker Prize",
    "Status": "Longlist",
    "Title": "Spies",
    "Author": "Michael Frayn",
    "Publisher": "Faber & Faber"
  },
  {
    "Year": 2002,
    "Award": "Booker Prize",
    "Status": "Longlist",
    "Title": "Still Here",
    "Author": "Linda Grant",
    "Publisher": "Little Brown"
  },
  {
    "Year": 2002,
    "Award": "Booker Prize",
    "Status": "Longlist",
    "Title": "The Mulberry Empire",
    "Author": "Philip Hensher",
    "Publisher": "Flamingo"
  },
  {
    "Year": 2002,
    "Award": "Booker Prize",
    "Status": "Longlist",
    "Title": "Who’s Sorry Now?",
    "Author": "Howard Jacobson",
    "Publisher": "Cape"
  },
  {
    "Year": 2002,
    "Award": "Booker Prize",
    "Status": "Longlist",
    "Title": "If Nobody Speaks of Remarkable Things",
    "Author": "Jon McGregor",
    "Publisher": "4th Estate"
  },
  {
    "Year": 2002,
    "Award": "Booker Prize",
    "Status": "Longlist",
    "Title": "Dorian, an Imitation",
    "Author": "Will Self",
    "Publisher": "Viking"
  },
  {
    "Year": 2002,
    "Award": "Booker Prize",
    "Status": "Longlist",
    "Title": "The Autograph Man",
    "Author": "Zadie Smith",
    "Publisher": "Hamish Hamilton"
  },
  {
    "Year": 2002,
    "Award": "Booker Prize",
    "Status": "Longlist",
    "Title": "To the Last City",
    "Author": "Colin Thubron",
    "Publisher": "Chatto & Windus"
  },
  {
    "Year": 2003,
    "Award": "Booker Prize",
    "Status": "Winner",
    "Title": "Vernon God Little",
    "Author": "DBC Pierre",
    "Publisher": "Faber & Faber"
  },
  {
    "Year": 2003,
    "Award": "Booker Prize",
    "Status": "Shortlist",
    "Title": "Brick Lane",
    "Author": "Monica Ali",
    "Publisher": "Doubleday"
  },
  {
    "Year": 2003,
    "Award": "Booker Prize",
    "Status": "Shortlist",
    "Title": "Oryx and Crake",
    "Author": "Margaret Atwood",
    "Publisher": "Bloomsbury"
  },
  {
    "Year": 2003,
    "Award": "Booker Prize",
    "Status": "Shortlist",
    "Title": "The Good Doctor",
    "Author": "Damon Galgut",
    "Publisher": "Atlantic Books"
  },
  {
    "Year": 2003,
    "Award": "Booker Prize",
    "Status": "Shortlist",
    "Title": "Notes on a Scandal",
    "Author": "Zoë Heller",
    "Publisher": "Viking"
  },
  {
    "Year": 2003,
    "Award": "Booker Prize",
    "Status": "Shortlist",
    "Title": "Astonishing Splashes of Colour",
    "Author": "Clare Morrall",
    "Publisher": "Tindal Street Press"
  },
  {
    "Year": 2003,
    "Award": "Booker Prize",